mnemonic,item_code,item_name,confidentiality,item_type,description
FCEX,M874,CROSS-BORDER CLAIMS AND CLAIMS ON LOCAL RESIDENTS: TRADING ASSETS - OFFSETTING POSITIONS FOR TRADING BOOK,Y,F,FFIEC009 (FCEX) - Trading Assets (Columns 17 and 18) In Column 17; report the fair value of the reporterÆs trading account assets that are included in Columns 1 through 10 of Schedule C; Part II. Exclude from this column derivative claims; as these should be reported on Schedule D. CUSIP netting is permissible if the position was reported net on Schedule C; Part II Columns 1 through 10. In Column 18; report short positions in securities that have the same issuer (on a legal entity basis) and bro
FCEX,M875,CROSS-BORDER AND FOREIGN-OFFICE COMMITMENTS AND GUARANTEES: GUARANTEES (EXCLUDING CREDIT DERIVATIVES SOLD),Y,F,FFIEC009 (FCEX) - Guarantees (Excluding Credit Derivatives Sold) (Column 2) In Column 2; report; on an ultimate-risk basis; all legally binding guarantees and insurance contracts (see Sections II.F.1 and II.F.2) issued by the reporters U.S. or foreign offices; excluding credit derivatives sold. Do not include guarantees which provide protection only between consolidated units of the reporter. Include the full amount of outstanding and unused financial and performance standby letters of credit in
FCEX,M876,CREDIT DERIVATIVES (BY REFERENCE ENTITY): GROSS-GROSS: TOTAL CREDIT DERIVATIVES PURCHASED,Y,F,FFIEC009 (FCEX) Report in Columns 3 through 6; by country of the underlying reference entity; the notional value of all outstanding credit derivatives sold and of those credit derivatives purchased that are not reported as a risk transfer in Schedule C; Parts 1 and II (see Section II.H.1). Credit protection purchased to hedge/offset credit protection sold; or for speculative purposes; should be excluded as a risk transfer from Schedule C; Parts I and II; and reported in Columns 3 and 5 of Schedu
FCEX,M877,CREDIT DERIVATIVES (BY REFERENCE ENTITY): GROSS-GROSS: TOTAL CREDIT DERIVATIVES SOLD,Y,F,FFIEC009 (FCEX) - Report in Columns 3 through 6; by country of the underlying reference entity; the notional value of all outstanding credit derivatives sold and of those credit derivatives purchased that are not reported as a risk transfer in Schedule C; Parts 1 and II (see Section II.H.1). Credit protection purchased to hedge/offset credit protection sold; or for speculative purposes; should be excluded as a risk transfer from Schedule C; Parts I and II; and reported in Columns 3 and 5 of Sche
FCEX,M878,CREDIT DERIVATIVES (BY REFERENCE ENTITY): GROSS-NET: TOTAL CREDIT DERIVATIVES PURCHASED,Y,F,FFIEC009 (FCEX) - Gross-Net Total Credit Derivatives Purchased (Column 5 ) Report in Columns 5 and 6; as appropriate; the consolidated net position of credit derivative contracts included in Column 3 and 4. Netting may be done only when all the following apply: 1) there are offsetting purchased and sold positions on the same reference entity (on a legal entity basis); 2) the contracts are with the same counterparty; 3) the contracts are subject to a legally enforceable master netting agreement. 
FCEX,M879,CREDIT DERIVATIVES (BY REFERENCE ENTITY): GROSS-NET: TOTAL CREDIT DERIVATIVES SOLD,Y,F,FFIEC009 (FCEX) - Gross-Net Total Credit Derivatives Sold (Column 6 ) Report in Columns 5 and 6; as appropriate; the consolidated net position of credit derivative contracts included in Column 3 and 4. Netting may be done only when all the following apply: 1) there are offsetting purchased and sold positions on the same reference entity (on a legal entity basis); 2) the contracts are with the same counterparty; 3) the contracts are subject to a legally enforceable master netting agreement. Contr
FCEX,M880,FAIR VALUE OF FOREIGN EXCHANGE AND DERIVATIVE PRODUCTS: NBFIS,Y,F,Report the positive fair value of derivative contracts by sector (see Section II.D) in Columns 1 through 4; and the total in Column 5. For Schedule D; sectors consist of Banks; Public; NBFIs and Other. Other consists of the residual claims which cannot be classified in the other three categories. If the reporter chooses; it may report separately foreign-office claims on local residents in Columns 7 and foreign-office liabilities to local residents in Column 8; and report only cross-border claims
FCEX,M956,CROSS BORDER CLAIMS AND CLAIMS ON LOCAL RESIDENTS: TRADING ASSETS,Y,F,FFIEC009 (FCEX) TRADING ASSETS (Columns 17 and 18) In Column 17; report the fair value of the reporter's trading account assets that are included in Columns 1 through 10 of Schedule C; Part II. Exclude from this column derivative claims; as these should be reported on Schedule D. 'CUSIP netting' is permissible if the position was reported net on Schedule C; Part II Columns 1 through 10. FFIEC009a (CEXA) For each country; distribute the amounts reported in Columns 1 and 2 that are claims classifi
FCEX,PG76,Collateral Held Against Claims With No Risk Transfer - Of Which; U.S.,Y,F,As of 12/31/2022; in Column 16; report claims held where the country of the ultimate obligor (i.e.; the issuer of the collateral; or for cash collateral; the legal entity where the cash is held; which is the legal entity with the liability for the cash collateral) is the U.S. Also include in this column claims where U.S.-issued collateral was provided as part of a resale or securities lending agreement. If multiple securities are provided as collateral; only include in Column 16 the amount attri
FCEX,PG77,Collateral Held Against Claims With No Risk Transfer - Of Which; Resale and Reverse Repurchase Agreements and Securities Lending (Collateral),Y,F,As of 12/31/2022; in Column 18; report by country of collateral; securities reported in column 16 of Schedule C; Part II; that arise from resale agreements; securities lending transactions; or similar financing agreements. These claims should be reported on a guarantor basis based on the underlying collateral; not the counterparty (see Section II.F.5). The sum total of column 17 should equal the sum total of column 18.
